{
  "adapter": "existing_ocr_fixture_v1",
  "page_count": 1,
  "text": "SUPPLIER INVOICE\nINVOICE NUMBER: INV-8821\nPO NUMBER: PO-1001\nSUPPLIER: Apex Metals\nPART NUMBER: [not printed]\nQUANTITY: 44 PCS\nUNIT PRICE: USD 125.00\nTOTAL: USD 5500.00",
  "fields": [
    {
      "name": "invoice_number",
      "value": "INV-8821",
      "unit": null,
      "confidence": 0.99,
      "page": 1,
      "region": "header",
      "bbox": [
        0.08,
        0.08,
        0.92,
        0.16
      ]
    },
    {
      "name": "po_number",
      "value": "PO-1001",
      "unit": null,
      "confidence": 0.99,
      "page": 1,
      "region": "header",
      "bbox": [
        0.08,
        0.08,
        0.92,
        0.16
      ]
    },
    {
      "name": "supplier",
      "value": "Apex Metals",
      "unit": null,
      "confidence": 0.99,
      "page": 1,
      "region": "header",
      "bbox": [
        0.08,
        0.08,
        0.92,
        0.16
      ]
    },
    {
      "name": "part_number",
      "value": null,
      "unit": null,
      "confidence": 0.0,
      "page": 1,
      "region": "line_items",
      "bbox": [
        0.08,
        0.08,
        0.92,
        0.16
      ]
    },
    {
      "name": "quantity",
      "value": 44,
      "unit": "pcs",
      "confidence": 0.99,
      "page": 1,
      "region": "line_items",
      "bbox": [
        0.08,
        0.08,
        0.92,
        0.16
      ]
    },
    {
      "name": "unit_price",
      "value": 125.0,
      "unit": "USD",
      "confidence": 0.99,
      "page": 1,
      "region": "line_items",
      "bbox": [
        0.08,
        0.08,
        0.92,
        0.16
      ]
    },
    {
      "name": "total_amount",
      "value": 5500.0,
      "unit": "USD",
      "confidence": 0.99,
      "page": 1,
      "region": "totals",
      "bbox": [
        0.08,
        0.08,
        0.92,
        0.16
      ]
    }
  ]
}